{
  "$schema": "https://json-schema.org/draft/2020-12/schema",
  "$id": "https://ldttoolbox.example/poc/schemas/zone-result.schema.json",
  "title": "ZoneResult",
  "description": "Output of one Geo Analyst spatial operation: the geometry produced for one or more FormalRules, its operation, validity flag and provenance string.",
  "type": "object",
  "additionalProperties": false,
  "required": ["id", "ruleIds", "operation", "geometry", "geometryValid", "jurisdictie", "provenance", "computedBy", "computedAt"],
  "properties": {
    "jurisdictie": { "enum": ["nl", "be"] },
    "id": {
      "oneOf": [
        { "$ref": "#/$defs/uuid" },
        { "type": "string", "pattern": "^ZR-[A-Za-z0-9][A-Za-z0-9._-]*$" }
      ]
    },
    "requestId": {
      "oneOf": [
        { "$ref": "#/$defs/uuid" },
        { "type": "string", "pattern": "^OMR-[A-Za-z0-9][A-Za-z0-9._-]*$" }
      ]
    },
    "ruleIds": { "type": "array", "minItems": 1, "uniqueItems": true, "items": { "type": "string", "pattern": "^FR-[A-Z]{1,4}-\\d{2,3}$" } },
    "operation": { "enum": ["intersection", "difference", "union", "symdifference", "buffer", "identity", "clip", "none"] },
    "geometry": {
      "type": "object",
      "additionalProperties": false,
      "required": ["format", "payload", "crs"],
      "properties": {
        "format": { "enum": ["GeoJSON", "GML32", "WKT"] },
        "payload": {
          "oneOf": [
            { "$ref": "#/$defs/geojsonGeometry" },
            { "type": "string", "minLength": 10, "description": "GML 3.2 document or WKT string" }
          ]
        },
        "crs": { "type": "string", "pattern": "^EPSG:\\d{4,5}$" }
      }
    },
    "geometryValid": { "type": "boolean", "description": "result of the validity check (ST_IsValid equivalent) — V1 geometric gate" },
    "areaKm2": { "type": "number", "minimum": 0 },
    "operands": { "type": "array", "items": { "type": "string", "minLength": 2 }, "description": "zone ids / layer names consumed by the operation" },
    "provenance": { "type": "string", "minLength": 10, "description": "PROV-O narrative or resolvable URI: which agent run, which inputs and rule versions produced this geometry" },
    "computedBy": { "$ref": "#/$defs/agentRun" },
    "computedAt": { "$ref": "#/$defs/dateTime" }
  },
  "$defs": {
    "uuid": { "type": "string", "pattern": "^[0-9a-f]{8}-[0-9a-f]{4}-[0-9a-f]{4}-[0-9a-f]{4}-[0-9a-f]{12}$" },
    "dateTime": { "type": "string", "pattern": "^\\d{4}-\\d{2}-\\d{2}T\\d{2}:\\d{2}:\\d{2}(\\.\\d+)?(Z|[+-]\\d{2}:\\d{2})$" },
    "agentRun": { "type": "string", "pattern": "^[a-z0-9][a-z0-9-]*#[A-Za-z0-9][A-Za-z0-9._-]*$" },
    "geojsonGeometry": {
      "oneOf": [
        {
          "type": "object",
          "additionalProperties": false,
          "required": ["type", "coordinates"],
          "properties": {
            "type": { "enum": ["Point", "MultiPoint", "LineString", "MultiLineString", "Polygon", "MultiPolygon"] },
            "coordinates": { "type": "array" }
          }
        },
        {
          "type": "object",
          "additionalProperties": false,
          "required": ["type", "geometries"],
          "properties": {
            "type": { "const": "GeometryCollection" },
            "geometries": { "type": "array", "minItems": 1 }
          }
        }
      ]
    }
  }
}
