[
 {
  "id": "ZR-inclusion_union-fb4ebebf4a",
  "requestId": "84445ba0-b233-5a13-97ca-8ce7a086b725",
  "ruleIds": [
   "FR-AOI-01"
  ],
  "operation": "union",
  "jurisdictie": "nl",
  "geometry": {
   "format": "GeoJSON",
   "payload": {
    "type": "Polygon",
    "coordinates": [
     [
      [
       3.45,
       51.02
      ],
      [
       3.73,
       51.02
      ],
      [
       3.73,
       51.48
      ],
      [
       3.45,
       51.48
      ],
      [
       3.45,
       51.02
      ]
     ]
    ]
   },
   "crs": "EPSG:4326"
  },
  "geometryValid": true,
  "areaKm2": 1000.606325351,
  "operands": [
   "aoi"
  ],
  "provenance": "op=validity_check; ctx=aoi; make_valid_repairs=0; engine=poc-zone-engine/0.1 shapely/2.2.0 | op=validity_check; ctx=union layer=aoi; make_valid_repairs=0; engine=poc-zone-engine/0.1 shapely/2.2.0 | op=union; layer=aoi(lastChecked=2026-10-06T08:30:00Z); features=1; make_valid_repairs=0; area_m2=1000606325.350554; engine=poc-zone-engine/0.1 | op=validity_check; ctx=inclusion_union; make_valid_repairs=0; engine=poc-zone-engine/0.1 shapely/2.2.0 | op=inclusion_union; rules=FR-AOI-01; layers=aoi; area_m2=1000606325.350554; engine=poc-zone-engine/0.1",
  "computedBy": "geo-analyst#poc-zone-engine-0.1",
  "computedAt": "2026-10-15T05:19:03Z"
 },
 {
  "id": "ZR-intersection-6b76dceba0",
  "requestId": "84445ba0-b233-5a13-97ca-8ce7a086b725",
  "ruleIds": [
   "FR-AOI-01"
  ],
  "operation": "intersection",
  "jurisdictie": "nl",
  "geometry": {
   "format": "GeoJSON",
   "payload": {
    "type": "Polygon",
    "coordinates": [
     [
      [
       3.45,
       51.02
      ],
      [
       3.45,
       51.48
      ],
      [
       3.73,
       51.48
      ],
      [
       3.73,
       51.02
      ],
      [
       3.45,
       51.02
      ]
     ]
    ]
   },
   "crs": "EPSG:4326"
  },
  "geometryValid": true,
  "areaKm2": 1000.606325351,
  "operands": [
   "aoi"
  ],
  "provenance": "op=validity_check; ctx=clip_aoi; make_valid_repairs=0; engine=poc-zone-engine/0.1 shapely/2.2.0 | op=intersection; rules=FR-AOI-01; target=AOI; area_m2=1000606325.350554; engine=poc-zone-engine/0.1",
  "computedBy": "geo-analyst#poc-zone-engine-0.1",
  "computedAt": "2026-10-15T05:19:03Z"
 },
 {
  "id": "ZR-final-fcd27ca039",
  "requestId": "84445ba0-b233-5a13-97ca-8ce7a086b725",
  "ruleIds": [
   "FR-AOI-01"
  ],
  "operation": "union",
  "jurisdictie": "nl",
  "geometry": {
   "format": "GeoJSON",
   "payload": {
    "type": "Polygon",
    "coordinates": [
     [
      [
       3.45,
       51.02
      ],
      [
       3.45,
       51.48
      ],
      [
       3.73,
       51.48
      ],
      [
       3.73,
       51.02
      ],
      [
       3.45,
       51.02
      ]
     ]
    ]
   },
   "crs": "EPSG:4326"
  },
  "geometryValid": true,
  "areaKm2": 1000.606325351,
  "operands": [
   "aoi"
  ],
  "provenance": "op=validity_check; ctx=aoi; make_valid_repairs=0; engine=poc-zone-engine/0.1 shapely/2.2.0 | op=validity_check; ctx=union layer=aoi; make_valid_repairs=0; engine=poc-zone-engine/0.1 shapely/2.2.0 | op=union; layer=aoi(lastChecked=2026-10-06T08:30:00Z); features=1; make_valid_repairs=0; area_m2=1000606325.350554; engine=poc-zone-engine/0.1 | op=validity_check; ctx=inclusion_union; make_valid_repairs=0; engine=poc-zone-engine/0.1 shapely/2.2.0 | op=inclusion_union; rules=FR-AOI-01; layers=aoi; area_m2=1000606325.350554; engine=poc-zone-engine/0.1 | op=validity_check; ctx=clip_aoi; make_valid_repairs=0; engine=poc-zone-engine/0.1 shapely/2.2.0 | op=intersection; rules=FR-AOI-01; target=AOI; area_m2=1000606325.350554; engine=poc-zone-engine/0.1",
  "computedBy": "geo-analyst#poc-zone-engine-0.1",
  "computedAt": "2026-10-15T05:19:03Z"
 }
]
